Questions,Answers,,
UDP is what type of protocol?,Connectionless,,
What is an advantage of optical fiber over traditional copper wiring?,Less bulk,,
Which network topology uses a central hub or controller?,Star,,
How does the use of a router differ from a bridge in telecommunication?,"A router is a communication device that is used to connect two different networks, while a bridge is networking device that divides the network into different segments to manage the amount of traffic.""",,
The presentation layer of the OSI model translates data into an acceptable format usable by which layer?,The application layer,,
What the OSI Model is used to?,describe how communications happen across a network,,
"When internet service providers use fiber optic cables, which cable type are they most likely to use for home networks?",Plastic optical cable,,
Why are addresses important in networking?,They are used to identify both the network to which the device is connected to as well as the device itself.,,
Which protocol downloads a copy of an email and deletes the original email from the server?,POP3,,
"In what topology network, all the devices are connected back to a central hub or switch?",Star topology,,
What is the organization that currently regulates and manages the Internet ?,ICANN,,
Where does the cloud concept originate?,Network diagram,,
Which internet protocol is responsible for re transmitting lost or erroneous data packets?,TCP,,
What identifies the protocol or protocols available to the session layer for standardizing communications on a network?,TCP/IP,,
What main use does Telnet have in modern IT?,Telnet is often used for embedded devices.,,
What is the type of fiber used typically for long distance runs?,Single-mode,,
Which of these is the most common cable type to connect a home network to a cable modem using an internet service provider?,Coaxial,,
"When a user tries to access a web page, what does the system do first?",Searches the domain name in DNS.,,
What is the software or hardware used to connect two different networks is known as?,Gateway,,
Which of the following is true about half-duplex mode?,Data is transmitted in both directions but not at the same time.,,
Why is the role of RTCP important in VoIP communications?,It allows adjustments to be made to fine-tune transmissions.,,
What type of standards are built by the officials and network professionals in organizations? ,Formal standards,,
What organization sets the rules as to how credit card data is handled?,PCI,,
"Which of the following is a transmission mode that transmits in two directions, but only in one direction at a time?",Asynchronous,,
SIP signaling protocol for VoIP and Video-over-IP allows for a connection to be modified. Which of these is an example of a session modification?,Adding an additional participant.,,
Which of the following wireless communication technologies has the shortest range?,Near Field Communication,,
How many nodes for a network would a /23 be good for address space in IPv4?,Up to 512,,
What is the maximum number of zones that can be associated to a firewall?,Firewalls can have many zones associated to them.,,
What is the purpose of load balancing in a network?,It distributes traffic to allow for a balance in the network keeping services available,,
"Although security is important, why is there a need to use Wireless Access Point as a pass-through set-up which allows any server to get connected to the network?",To enable the peer devices to exchange data without much difficulty.,,
"If you want to prevent employees from disclosing sensitive company information, which network security type would be best to implement?",DLP,,
Which two protocols are NOT backward compatible?,802.11a Protocol 802.11b,,
What is the approximate distance between devices when establishing a connection using short-range wireless communication?,From a few centimeters to several meters,,
What is PSTN stands for?,Public Switched Telephone Network,,
Why is the role of RTCP important in VoIP communications?,It allows adjustments to be made to fine-tune transmissions.,,
What type of video-over-IP service relies on two-way communication?,Video conferencing,,
What is a specially built server?,is built with redundant power supplies to maintain constant availability,,
Which of the following devices can be used to interface computer networks that use different communication protocols?,Gateway,,
What is a specially designed server operating system can serve?,numerous concurrent clients connections,,
An office operates on 3 floors of a building. It comprises 4 different departments. Which of the following network implementation will most suit the office needs?,4 VLANs on 4 switches with trunk link connections,,
Which type of network transmission mode transmits data in both directions simultaneously?,Synchronous,,
"If you didn't have access to a highly-skilled IT network team, what would be a good option for a WAN (Wide Area Network)?",A fully carrier managed WAN.,,
What makes the symmetric DSL network type so different from the asymmetric type?,It has an equal balance between download and upload speeds.,,
What are two common WAN (Wide Area Network) design types?,Hub and spoke; Full mesh topology,,
What is the network layer converts?,Logical addresses into physical addresses,,
"In the OSI model, what does the application layer do?","This layer actively interacts with the operating system or application when the user decides to transfer files, read messages, or perform network-related activities.",,
What networking organizations set the standards for network communication?,all of these answers are correct,,
"At the 'receiving' computer, the transport layer provides input to which OSI layer?",The session layer,,
"What is the topology of a network describes how devices are connected via actual cabling, wireless connectivity, etc?",physical topology,,
"Consider a number of computers are in a network, and one computer crashes. In which of the following network topologies will the entire network also go down?",Ring,,
Which network topology uses a central hub or controller?,Star,,
What are WLAN Protocols?,WLAN Protocols are network protocols which govern data transmissions over wireless connectivity.,,
What are the reasons for the degradation of a wireless signal?,Reflection/Diffraction/ScatteringAll of the above,,
Which application operates in the frequency range 87.5 - 108 MHz?,FM Radio,,
What is wireless transmission happens when wireless equipment converts?,an electric current to electromagnetic waves,,
When are guest accounts most likely necessary?,a doctor's office in the waiting room,,
Which of the following is a method for securing data by using special mathematical algorithms to convert the data into a scrambled code before transmission?,Encryption,,
What would most likely benefit from registering its MAC addresses?,a small investment firm,,
Why did the first version of WPA use TKIP?,Many old devices still used WEP and TKIP was intended to make it easy to upgrade.,,
What is frequency Division Multiplexing is not used in ?,Air band radio,,
Which of the following is NOT true with respect to a band pass filter?,The band pass filter is present at the sender's side.,,
What part of an optical fiber cable reflects light back into the core as the cable bends?,Cladding,,
Crosstalk and attenuation are NOT a problem in which of the following media?,Fiber optic cable,,
Which of the following is NOT a basic component of a telecommunication network?,Remote control unit,,
In what way is a peer-to-peer network different from client/server networks?,"In peer-to-peer, tasks are allocated among all the members of the network while in a client/server network, a number of network clients or workstations request resources or services from the network.",,
How do clients communicate with the server?,The network,,
What is a typical communication network may consist of ?,"servers, internet connectivity devices, computers, routers and smart devices",,
A remote employee needs to be able to access corporate email and file sharing but doesn't necessarily have a lot of technical knowledge. What is the best access method?,VPN,,
What service does a VPN solution provide?,Remote access to private network resources,,
"In the VLAN configuration example, each department has their own set of user _____ that are required only for their specific jobs. This keeps each department from being able to access another departments data?",permissions,,
Why is Telnet discouraged as an access method?,Telnet is unsecure.,,
What IMAP can allow a user with multiple devices to ?,access their emails simultaneously from any of the devices.,,
"Apart from allowing a variety of media formats and sending multiple attachments at once, what other primary benefit did MIME bring to the world of email?",An unlimited number of characters in the body of the message.,,
"In order to check the nodes that are connected to a system, one can use the command?",netstat,,
The command tracert is used for which of the following purpose?,Identifying the route that a packet travels in the network before reaching the destination,,
What is Address Translation(AT)?,AT is mapping private IP addresses to public IP addresses,,
What is an IP address?,An IP (Internet Protocol) address is a series of numbers which is used to identify a device within a network environment,,
How does RIP route payloads?,By advertising a connected table to all neighbors every 30 seconds.,,
Which of the following statements is true?,Authoritative name servers respond to queries from recursive name servers,,
What is VOIP stands for?,Voice Over Internet Protocol,,
Which of the following statements about a VLAN environment is TRUE?,Computers or nodes by default are not VLAN aware,,
What is a VPN?,A network that is only accessible with the correct credentials,,
What is one advantage of cloud computing?,Simplicity,,
What is SSH uses to ensure authentication and security?,public-key cryptography,,
Where does the cloud concept originate?,Network diagram,,
"In WANs, which of the following is NOT a characteristic of mesh topology?",Broadcasts are transmitted over a backbone which is accessible and seen by all connected sites,,
Which type of network transmission mode transmits data in both directions simultaneously?,Synchronous,,
"In a cable network environment, what is the name of the cable type that connects from the wall outlet to the modem?",Coaxial,,
A data measurement unit that contains 8 bits of information is known as which of the following?,Byte,,
Which of these answers describes one possible method to prevent or limit the impacts of a DoS or DDoS?,Install and maintain anti-virus (AV) software,,
Network security is made up of which items?,"hardware devices, specialized software, physical security, and rules for people to follow",,
"Which is the oldest, least secure method of wireless security?",WEP,,
Why is a multi-layered approach to network security is best ?,Because different types of network security systems focus on different threats and vulnerabilities,,
A client/server system with a single server and multiple clients represent what tier in terms of network architecture?,Two-tier,,
Which of the following is true about TCP/IP or Transmission Control Protocol/Internet Protocol?,TCP/IP is a communication protocol that enables you to send and receive information over the Internet.,,
What is bandwidth of a computer network refers to?,the amount of data that can be transferred over a network per second,,
SD-WAN is best used for which task?,Connecting branches to the cloud,,
"Which of the following media is comparatively cheaper, lighter and easier to install?",Twisted pair cable,,
What is time multiplexing used for in computer science?,Sharing access to a commonly used resource,,
Which of the following is false with respect to Frequency Division Multiplexing?,There is no cross-talk issue in Frequency Division Multiplexing.,,
Which is a standard connector for unshielded twisted pair cable that resembles RJ-11 telephone jacks?,RJ-45,,
What type of coverage does Wi-Fi provide?,Medium range wireless communication,,
Which of the following is/are true?,Wireless Access Points connect devices that have WI-FI or Bluetooth connectivity.,,
What is a single Wi-Fi Access Point can cover a geographic area as large as ?,House,,
Which application operates in the frequency range 87.5 - 108 MHz?,FM Radio,,
Which of the following is true about half-duplex mode?,Data is transmitted in both directions but not at the same time.,,
"Which option contains the name of the layer responsible for translating, encrypting and compressing data within the OSI model?",Presentation,,
The transport layer performs data packet creation and what other types of services?,Error checking,,
What is it called when the receiving system lets the sender know the data was received at its destination ?,Acknowledgement,,
What is a star-wired ring hybrid topology?,It's set of star topologies are connected by a ring topology as the adjoining topology,,
What is parallel backbone networks differ from collapsed backbone networks in that parallel backbone components are implemented with ?,duplicate concurrent connections to the high level backbone route,,
What is a wireless network for Internet access in a large building is typically connected in?,mesh topology,,
What is the tree network topology is a special type of?,star/bus/hybrid topology ,,
What type of hardware device is a WiFi card?,A network interface card to establish a wireless connection,,
What is VLAN Identifiers are ?,managed by switch ports and used to identify each VLAN,,
A PCMCIA LAN card typically goes where?,Inside a laptop,,
What is the individuals and social networking platforms that have the ability to store Terabytes of data away from local devices by the use of it?,The Cloud,,
What is variable length subnet masking used for?,It is used to create smaller networks by using variants on classful subnets.,,
What is the organization that currently regulates and manages the Internet ?,ICANN,,
Represents a standard IP address?,10101000/01001010/00000101/11100111,,
Which of these is not one of TCP/IP's five protocol layers?,Transmission,,
What is the two types of signaling protocols for VoIP and Video-Over-IP handle controls for these two areas?,Sessions and media,,
Which part of the transport protocol works in conjunction with signaling protocols in VoIP communications?,RTP,,
What is a MPLS makes use of to make a faster and more efficient network ?,Short path labels,,
What is signaling protocols exist to?,determine the connection between the sending device and the receiving device.,,
What is the mail command starts the process of sending sequential lines of texts with the message?,354,,
The command tracert is used for which of the following purpose?,Identifying the route that a packet travels in the network before reaching the destination,,
"In the SMTP server to server set up, the email clients serve to What ?",Receive/Send and queue messages between SMTP servers and clients,,
What is IMAP?,(IMAP) is a standard internet protocol used for the retrieval of email messages from an email server.,,
"What is the official name of the second version of Secure Shell, which became the standard in 2006?",SSH2,,
What is one of the major differences between a DSL network and a cable network?,"DSL only worked well if the modem was close to the main service area, cable does not have such restrictions.",,
"Of the options listed, which is the most used WAN (Wide Area Network) carrier?",MPLS,,
"In WANs, what advantage does the ring topology have over the bus topology?",Data transmission is multidirectional,,
What are the benefits of a DSL network over the previous method known as dial-up?,All of these answers are correct.,,
What unit of data measurement is used with synchronous transmissions?,Block,,
What is the 'local factor' in designing a network?,The infrastructure available locally through the local exchange carrier,,
How IMAP is the vehicle?,"messages are moved, organized and manipulated between the mail server and the mail client application",,
A client plans to have a network to connect many computers in one room and at the same time allow access to the Internet from these computers. What are the devices that the client is going to need?,A switch and a router.,,
Which device provides access control functionality between networks?,A router,,
What kind of channel does broadband transmission use?,Bandpass channel,,
What is an advantage of optical fiber over traditional copper wiring is?,Less bulk,,
Which option below lists the function(s) of a modem?,modulation and demodulation,,
Which of the following connectors are also used with multimode and single-mode fiber optic cables for accessing gigabit ethernet?,MT-RJ,,
Which of the following devices can be used to interface computer networks that use different communication protocols?,Gateway,,
What does NIC stand for?,Network interface card or controller,,
How does the use of a router differ from a bridge in telecommunication?,"A router is a communication device that is used to connect two different networks, while a bridge is networking device that divides the network into different segments to manage the amount of traffic.",,
Which of the following contains a large number of ports to connect network segments and sends the data it receives only to specific ports?,Switch,,
What makes a computer service a cloud computing service?,Being hosted on the internet,,
What access method works best over mobile connections?,Mosh.,,
What is one disadvantage of cloud computing?,Access,,
What is TCP/IP?,"TCP/IP (Transmission Control Protocol/Internet Protocol) is a suite of communication protocols used to interconnect network devices on the internet. It provides end-to-end connectivity by specifying how data should be formatted, addressed, transmitted, routed, and received.",,
Difference between TCP and UDP?,"TCP (Transmission Control Protocol) is connection-oriented and provides reliable, ordered data transmission. UDP (User Datagram Protocol) is connectionless and does not guarantee delivery or ordering of data.",,
Explain the HTTP protocol?,"HTTP (Hypertext Transfer Protocol) is the foundation of data communication on the World Wide Web. It defines the structure of messages and how they're transmitted, allowing web browsers to retrieve and display web pages.",,
What is SMTP?,SMTP (Simple Mail Transfer Protocol) is used for sending and receiving emails. It works between mail servers to send messages from a client to the server or between servers.,,
Difference between IPv4 and IPv6?,"IPv4 uses 32-bit addresses, allowing for approximately 4.3 billion unique addresses. IPv6 uses 128-bit addresses, enabling significantly more unique IP addresses, essential for the growing number of internet-connected devices.",,
Define FTP?,FTP (File Transfer Protocol) is used to transfer files between a client and a server on a computer network. It allows for the downloading and uploading of files.,,
What is DNS?,"DNS (Domain Name System) translates domain names into IP addresses, making it easier for users to access websites by typing in a domain name rather than a long string of numbers.",,
Explain SNMP?,SNMP (Simple Network Management Protocol) is used to manage devices on IP networks. It is commonly used in network management systems to monitor network-attached devices for conditions that warrant administrative attention.,,
Describe SSH?,SSH (Secure Shell) is a cryptographic network protocol used for secure communication over an unsecured network. It provides a secure channel over an insecure network by using encryption and authentication.,,
What is DHCP?,DHCP (Dynamic Host Configuration Protocol) is used to automatically assign IP addresses and other network configuration information to devices on a network. It simplifies the process of connecting to a network by assigning addresses dynamically.,,
What are Network protocols?,"Network protocols are a set of rules and conventions governing how devices communicate and interact in a computer network. These protocols define the procedures, formats, and specific requirements for communication between different devices. They establish the standards for data transmission, including how data is formatted, transmitted, received, and acknowledged within a network.",,
What is Standardization?,Protocols ensure that different devices and systems can communicate with each other by following the same set of rules and standards.,,
What is Data Formatting?,"They define how data is structured, encoded, and formatted for transmission, specifying the order and organization of the information being exchanged.",,
What is Addressing and Routing?,Protocols determine how devices are addressed within a network and how data is routed from one point to another.,,
What is Error Detection and Correction?,"Some protocols include mechanisms to detect errors during data transmission and correct them, ensuring data integrity.",,
What is Sequencing and Flow Control?,Certain protocols manage the sequence of data transmission and regulate the flow of information between devices to prevent overload or data loss.,,
"SSH client and server utilities are found on most operating systems by default, except What ?",Microsoft Windows,,
Which of the following is a medium used by internet service providers to transmit data?,Copper wire,,
What is a server?,A computer that hosts data and other resources for clients,,
What could Wi-Fi 7 provide support for?,Send data on multiple frequencies,,
What is a network client?,A computer that connects to a server in order to use and share resources with it,,
What is a star-wired ring hybrid topology?,It's set of star topologies are connected by a ring topology as the adjoining topology,,
What is the tree network topology is a special type of?,star bus hybrid topology,,
What is the label in multi-protocol label switching contains?,information on the predefined path for the packets to reach their destination,,
What is padding data required within an Ethernet frame to?,fulfill minimum field length requirement,,
Which of the following statements is true when a user first makes a DNS query by typing the domain name into the web browser?,The local DNS cache is queried,,
"When it comes to home networks, how is the primary IP address generated for all devices?","The ISP assigns a static address to the location, which is translated through a NAT.",,
Explain about RARP?,"Frame Format of RARP , Encapsulation",,
Explain about Internet Control Message Protocol ?,"Message types,Message format,Error Reporting,Echo Request and reply,Time stamp request and reply,Address mask request and reply message.",,
What is routing?,Routing is a process of selecting paths in a network through which network traffic is sent.,,
Define an internetwork.?,A collection of interconnected network is called an internetwork.,,
What does routing metric mean?,A routing metric is a unit calculated by a routing algorithm for selecting or rejecting a routing path for transferring data/traffic.,,
What are the metrics used in determining the best path for a routing protocol?," Bandwidth, Delay, Load, Reliability, Cost, Hop count, MTU, Ticks",,
What is multicasting?,Multicasting is the delivery of information to a group of destinations simultaneously using the mostefficient strategy to deliver the messages over each link of the network only once.,,
What are different types of multicast routing?,"Reverse path multicasting , Reverse path broadcasting",,
What is multicast? What is the motivation for developing multicast?,Multicasting means delivering the same packet simultaneously to a group of clients. Motivation for developing multicast is that there are applications that want to send a packet to more than one destination hosts.,,
Define RIP?,RIP is a dynamic protocol used for finding the best route or path from ene-to-end over a network by using a routing metric/ hop count algorithm.,,
What is OSPF?,OSPF protocol is a router protocol used within larger autonomous system networks in preference to the Routing Information Protocol (RIP).,,
What are the features of OSPF?," Authentication of routing messages, Additional hierarchy, Load balancing",,
Mention any four applications of multicasting?," Broad casts of audio and video, Video conferencing, Shared Applications, IGMP is used by multicast routers to keep track of membership in a multicast group.",,
Describe the process of routing packets ?,Routing is the act of moving information across an internetwork from a source to a destination.,,
What are the some routing algorithm types?,"The routing types are static, dynamic, flat, hierarchical, host-intelligent, router- intelligent, intra-domain, inter-domain, link state and distance vector.",,
What is a benefit of DHCP?,"Simplicity: clients need to manual configuration, Mobility and hosts: Hosts may move between networks without reconfiguring, Mobility of network: Possible for internet service providers to reconfigure customers address transparently., Save address space if individual clients are not always active.",,
What are the 3 types of routing performed by BGP?,"Inter-autonomous system routing, Intra-autonomous system routing, Pass through autonomous system routing",,
What are the different kinds of multicast routing?,"DVMRP, PIM, MSDP, MOSPF ,MBGP",,
Write the types of PIM ?,"PIM Sparse mode, PIM Dense mode, Bidirectional PIM, Source Specific Multicast (SSM)",,
How can the routing be classified?,"The routing can be classified as,Adaptive routing ,Non-adaptive routing.",,
What are the salient features of IPv6?,"Salient features are: Efficient and hierarchical addressing and routing infrastructures, IPv6 networks provide auto configuration capabilities, Better support for QOS, Large Address space.",,
