Questions,Answers,,
What is the purpose of a subnet mask?,"A subnet mask is used to divide an IP network into subnetworks, enabling the identification of network and host portions of an IP address.",,
What is the purpose of a default gateway?,The default gateway is used to forward network traffic from a local network to remote networks.,,
What is the purpose of a VLAN (Virtual Local Area Network)?,"VLANs are used to logically segment a single physical network into multiple broadcast domains, improving network efficiency and security.",,
What is the purpose of DNS (Domain Name System)?,"DNS is used to translate domain names (e.g., www.example.com) into their corresponding IP addresses, allowing users to access websites using human-readable names.",,
What is the purpose of NAT (Network Address Translation)?,"NAT is used to translate private IP addresses to public IP addresses or vice versa, enabling devices on a private network to communicate with devices on the internet.",,
What is the purpose of the DHCP (Dynamic Host Configuration Protocol)?,"DHCP is used to automatically assign IP addresses, subnet masks, and other network configuration parameters to devices on a network.",,
What is the purpose of STP (Spanning Tree Protocol)?,"STP is used to prevent network loops in Ethernet networks by selectively blocking redundant paths, ensuring a loop-free topology.",,
What is TCP/IP?,"TCP/IP (Transmission Control Protocol/Internet Protocol) is a suite of communication protocols used to interconnect network devices on the internet. It provides end-to-end connectivity by specifying how data should be formatted, addressed, transmitted, routed, and received.",,
Difference between TCP and UDP?,"TCP (Transmission Control Protocol) is connection-oriented and provides reliable, ordered data transmission. UDP (User Datagram Protocol) is connectionless and does not guarantee delivery or ordering of data.",,
Explain the HTTP protocol?,"HTTP (Hypertext Transfer Protocol) is the foundation of data communication on the World Wide Web. It defines the structure of messages and how they're transmitted, allowing web browsers to retrieve and display web pages.",,
What is SMTP?,SMTP (Simple Mail Transfer Protocol) is used for sending and receiving emails. It works between mail servers to send messages from a client to the server or between servers.,,
Difference between IPv4 and IPv6?,"IPv4 uses 32-bit addresses, allowing for approximately 4.3 billion unique addresses. IPv6 uses 128-bit addresses, enabling significantly more unique IP addresses, essential for the growing number of internet-connected devices.",,
Define FTP?,FTP (File Transfer Protocol) is used to transfer files between a client and a server on a computer network. It allows for the downloading and uploading of files.,,
What is DNS?,"DNS (Domain Name System) translates domain names into IP addresses, making it easier for users to access websites by typing in a domain name rather than a long string of numbers.",,
Explain SNMP?,SNMP (Simple Network Management Protocol) is used to manage devices on IP networks. It is commonly used in network management systems to monitor network-attached devices for conditions that warrant administrative attention.,,
Describe SSH?,SSH (Secure Shell) is a cryptographic network protocol used for secure communication over an unsecured network. It provides a secure channel over an insecure network by using encryption and authentication.,,
What do you mean by ARP?,ARP stands for Address resolution protocol. ARP is a dynamic mapping method that finds a physical address for a given a logical address. i.e. mapping IP address to physical address.,,
What do you mean by RARP?,"RARP stands for Reverse Address resolution protocol, maps a MAC address to an IP address.",,
What are the functions of MAC?,"MAC sub layer resolves the contention for the shared media. It contains synchronization, flag, flow and error control specifications necessary to move information from one place to another, as well as the physical address of the next station to receive and route a packet.",,
Define the term medium access control mechanism?,The protocol that determines who can transmit on a broadcast channel are called medium access control (MAC) protocol. The MAC protocols are implemented in the Mac sub-layer which is the lower sublayer of the data link layer.,,
What is bridge?,Bridge is a hardware networking device used to connect two LANs. A bridge operates at data link layer of the OSI reference model.,,
What is a repeater?,Repeater is a hardware device used to strengthen signals being transmitted on a network.,,
Define router?,A network layer device that connects networks with different physical media and translates between different network architecture.,,
What is a switch?,A switch is a networking device that manages networked connections between devices on a star networks.,,
What is mean by Ethernet?,Ethernet is a networking technology developed in 1970 which is governed by the IEEE 802.3 specifications.,,
What is the advantages of Ethernet?,"Inexpensive ,Easy to install ,Supports various writing technologies.",,
Identify the class and default subnet mask of the IP address 217.65.10.7 ?,IP Address 217.65.10.7 belongs to Class C. Its subnet mask is 255.255.255.0.,,
What are the limitations of bridges?," Scale, Heterogeneity",,
Define Bluetooth ?,Bluetooth is a wireless technology standard for exchanging data over short distances (using shortwavelength UHF radio waves in the ISM band from 2.4 to 2.485 GHz) from fixed and mobile devices and building personal area networks (PANs).,,
What are the 3 levels of hierarchy in IP Addressing?," Netid, Subnetid, Hostid",,
What are the functions of bridge?," Connecting networks, Filtering information so that network traffic for one portion of the network does not congest the rest of the network.",,
Define sub- netting ?,Sub-netting is a technique that allows a network administrator to divide one physical network into smaller logical networks and thus control the flow of traffic for security or efficiency reasons.,,
Explain detail about IEEE 802.3 MAC sub-layer?,"Frame format,Frame length,Ethernet specification,Manchester encoding,Binary exponential Back off algorithm,Ethernet performance",,
Explain detail about Bluetooth architecture?,"Radio layer,Baseband layer,Frame format,L2CAP,Hidden Station Problem",,
Explain about IPv4 address ?,"Classful addressing,Special IP addressing,Classless addressing,Header format,IP fragmentation Options,Sub-netting a network",,
Explain about Address resolution protocol Packet format?,"Encapsulation,Proxy ARP",,
Explain about RARP?,"Frame Format of RARP , Encapsulation",,
Explain about Internet Control Message Protocol ?,"Message types,Message format,Error Reporting,Echo Request and reply,Time stamp request and reply,Address mask request and reply message.",,
What is routing?,Routing is a process of selecting paths in a network through which network traffic is sent.,,
Define an internetwork.?,A collection of interconnected network is called an internetwork.,,
What does routing metric mean?,A routing metric is a unit calculated by a routing algorithm for selecting or rejecting a routing path for transferring data/traffic.,,
What are the metrics used in determining the best path for a routing protocol?," Bandwidth, Delay, Load, Reliability, Cost, Hop count, MTU, Ticks",,
What is multicasting?,Multicasting is the delivery of information to a group of destinations simultaneously using the mostefficient strategy to deliver the messages over each link of the network only once.,,
What are different types of multicast routing?,"Reverse path multicasting , Reverse path broadcasting",,
What is multicast? What is the motivation for developing multicast?,Multicasting means delivering the same packet simultaneously to a group of clients. Motivation for developing multicast is that there are applications that want to send a packet to more than one destination hosts.,,
Define RIP?,RIP is a dynamic protocol used for finding the best route or path from ene-to-end over a network by using a routing metric/ hop count algorithm.,,
What is OSPF?,OSPF protocol is a router protocol used within larger autonomous system networks in preference to the Routing Information Protocol (RIP).,,
What are the features of OSPF?," Authentication of routing messages, Additional hierarchy, Load balancing",,
Mention any four applications of multicasting?," Broad casts of audio and video, Video conferencing, Shared Applications, IGMP is used by multicast routers to keep track of membership in a multicast group.",,
Describe the process of routing packets ?,Routing is the act of moving information across an internetwork from a source to a destination.,,
What are the some routing algorithm types?,"The routing types are static, dynamic, flat, hierarchical, host-intelligent, router- intelligent, intra-domain, inter-domain, link state and distance vector.",,
What is a benefit of DHCP?,"Simplicity: clients need to manual configuration, Mobility and hosts: Hosts may move between networks without reconfiguring, Mobility of network: Possible for internet service providers to reconfigure customers address transparently., Save address space if individual clients are not always active.",,
What are the 3 types of routing performed by BGP?,"Inter-autonomous system routing, Intra-autonomous system routing, Pass through autonomous system routing",,
What are the different kinds of multicast routing?,"DVMRP, PIM, MSDP, MOSPF ,MBGP",,
Write the types of PIM ?,"PIM Sparse mode, PIM Dense mode, Bidirectional PIM, Source Specific Multicast (SSM)",,
How can the routing be classified?,"The routing can be classified as,Adaptive routing ,Non-adaptive routing.",,
What are the salient features of IPv6?,"Salient features are: Efficient and hierarchical addressing and routing infrastructures, IPv6 networks provide auto configuration capabilities, Better support for QOS, Large Address space.",,
Write the BGP Message types ?,"Open, Update, Notification, Keep-alive",,
Explain IP addressing method?,"Internetwork protocol (IP) Datagram, Addressing Classes, Dotted decimal notation",,
What is the type of bridges?,"Simple bridge, Multi-port bridge ,Transparent bridge",,
Explain sub-netting ?,"Three levels of hierarchy masking, Masks without sub-netting, Masks with sub-netting, Finding the sub-network address, Boundary level masking, Non-boundary level masking",,
Write short notes about routers ?,"Routing concepts, Least-cost routing, Non adaptive routing, Adaptive routing, Packet lifetime",,
What are the fields on which the UDP checksum is calculated? Why?,"UDP checksum includes a pseudo header, the UDP header and the data coming from the application layer.",,
What are the advantages of using UDP over TCP?,"UDP does not include the overhead needed to detect reliability , It does not need to maintain the unexpected deception of data flow , UDP requires less processing at the transmitting and receiving of hosts. , It is simple to use for a network, The OS does not need to maintain UDP connection information.",,
What is TCP?,"TCP provides a connection oriented, reliable byte stream service. The connection oriented means the two applications using TCP must establish a TCP connection with each other before they can exchange data.",,
Define congestion ?,"When too many packets rushing to a node or a part of network, the network performance degrades. This situation is called as congestion.",,
What is the flag used in TCP header ?,"TCP header contains six flags. They are URG, ACK, PSH, RST, SYN, FIN",,
What is the approaches to improve the QoS ?,"Fine grained approaches, which provide QoS to individual applications or flows. Integrated services, QoS architecture developed in the IETE and often associated with RSVP.",,
What do you mean by QoS?,Quality of Service is used in some organizations to help provide an optimal end user experience for audio and video communications. QoS is most commonly used on networks where bandwidth is limited with a large number of network packets competing for a relatively small amount of available and width.,,
What is multiplexing?,"The job of gathering data chunks at the sources host from different sockets, encapsulating each data chunks with header information to create segments, and passing the segments to the network layer is called multiplexing.",,
What is de-multiplexing?,The job of delivering the data in a transport layer segment to the correct socket is called demultiplexing.,,
What is RTT?,"RTT is an acronym for Round Trip Time: it is a measure of the time it takes for a packet to travel from a computer, across a network to another computer, and back.",,
What is the segment?,Transport layer protocols send data as a sequence of packets. In TCP/IP these packets are called segments.,,
What is a port?,Applications running on different hosts communicate with TCP with the help of a concept called as ports. A port is a 16 bit unique number allocated to a particular application.,,
What is the services of end to end services?,"Guarantee message delivery, Delivery messages in the same order they are sent , Deliver at most one copy of each message, Support arbitrarily large message. , Support synchronization.",,
What is congestion?,"When load on network is greater than its capacity, there is congestion of data Packets. Congestion occurs because routers and switches have queues or buffers.",,
What are the functions of transport layer?,"Breaks messages into packets , Connection control. , Addressing. ,Provide reliability.",,
What are the types of QoS tools?,"Classification Congestion management, Congestion avoidance , Shaping/policing , Link efficiency",,
List some ways to deal with congestion ?,"packet elimination , Flow control , Buffer allocation , Choke packets",,
Define network congestion?,When two or more nodes would simultaneously try to transmit packets to one node there is a high probability that the number of packets would exceed the packet handling capacity of the network and lead to congestion.,,
What is the three types of addresses in TCP/IP?,"Three types of addresses are used by systems using the TCP/IP protocol: the physical address, the internetwork address (IP address), and the port address.",,
What is the flow characteristics related to QoS?,"Reliability , Delay , Jitter , Bandwidth",,
What are the techniques to improve QoS?,"Scheduling , Traffic shaping , Resource reservation , Admission control",,
What is Socket address?,The combination of IP address and port address is called Socket address.,,
What are the two types of protocols used in Transport layer?,"TCP , UDP",,
Define Throughput?,It is defines as a number of packets passing through the network in a unit of time.,,
Define UDP?,"User datagram protocol is a Unreliable, connectionless protocol, used along with the IP protocol.",,
What is the need of port numbers?,Port numbers are used as an addressing mechanism in transport layer.,,
What are the types of port numbers used in transport layer?,"Well-known port , Registered port , Dynamic port",,
Why TCP services are called Stream delivery services?,TCP allows the sending process to deliver data as a stream of bytes and the receiving process to deliver data as a stream of bytes. So it is called as stream of bytes.,,
Define jitter?,"Jitter is defined as a variation in the delay of received packets. The sending side transmits packets in a continuous stream and spaces them evenly apart. Because of network congestion, improper queuing, or configuration errors, the delay between packets can vary instead of remaining constant.",,
Explain connectionless service ?,In connection less service there is no connection between transmitter & receiver Ex: UDP,,
Explain connection oriented service?,In connection oriented service there is a connection between transmitter & receiver Ex: TCP,,
What is Unicast communication?,Unicast communication is one source sending a packet to one destination.,,
What is Multicast communication?,Multicast communication is one source sending a packet to multiple destinations.,,
Explain the duties of transport layer?,"End to end delivery , Addressing , Reliable delivery , Error control , Sequence control , Loss control , Duplication control , Flow control , Multiplexing",,
What is UDP?,"Source port address , Destination port address , Total length , Checksum",,
What is TCP?,"Source port address,Destination port address,Sequence number,Acknowledgement number,Header length,Reserved Control,Window size,Check sum,Urgent pointer,Options and padding",,
What is congestion control?,"Congestion Control , BECN , FECN , Four situations , Discarding",,
What is Congestion Avoidance?,"DECbit scheme , RED",,
What is QoS Policing in detail?,"Integrated service , Traffic Shaping , Admission Control , RSVP , Differentiated Services/Qos",,
Define the two types of user agents in the electronic mail system?,"command driven , GUI based",,
Explain the command driven ?,It normally accepts a one character command from the keyboard to perform its task.,,
Explain the GUI based ?,They contain GUI components that allow the user to interact with the software by using both the keyword and mouse.,,
What is DNS?,DNS is a client/server application that identifies each host on the internet with a unique user friendly name.,,
What is the purpose of inverse domain?,The inverse domain is used to map an address to a name.,,
What is SMTP?,Simple Mail Transfer Protocol is a standard and reliable host to host mail transport protocol that operates over the TCP port 25.,,
What is the Purpose of SNMP?,"The primary purpose of SNMP is to allow the network administrator to monitor and configure devices on the network, remotely via the network. These configuration and monitoring capabilities are collectively referred to as management.",,
What is the Domain name system responsible for?,The Domain Name system converts domain names (of the form www.vtubooks.com) into IP numbers.,,
What are the four main properties of HTTP?,"Global Uniform Resource Identifier, Request response exchange, Statelessness, Resource meta data",,
What is SMTP used for?,"SMTP is used when email is delivered from an email client, such as Outlook Express, to an email server or when email is delivered from one email server to another.",,
What is virtual terminal?,A virtual terminal is a data structure maintained by either the application software or a local terminal.,,
What are the basic functions of email?,"Composition, Transfer, Reporting, Displaying and Disposition of mails.",,
Define WWW?,It is an internet application that allows users to view web pages and move from one web page to another.,,
What is the web browser?,Web browser is a software program that interprets and displays the contents of HTML web pages.,,
What is URL?,URL is a string identifier that identifies a page on the World Wide Web.,,
What do you mean by TELNET?,TELNET is used to connect remote computers and issue commands on those computers.,,
What is simple mail transfer protocol?,The TCP/IP protocol that supports electronic mail on the internet is called Simple Mail Transfer Protocol (SMTP). It is a system for sending messages to other computer users based on email addresses.,,
What do you mean by File transfer protocol?,It is a standard mechanism provided by the internet for copying a file from one host to another.,,
What are the two types of connections in FTP?,"Control connection , Open connection",,
Define HTTP?,"It is used mainly to access data on the World Wide Web. The protocol transfers data in the form of plaintext, hypertext, audio, video and soon.",,
What are the types of messages in HTTP transaction?,"Request messages, Response messages",,
What are the parts of a browser?,"A controller, A client program, Interpreter",,
Name the four aspects of security?,"Privacy, Authentication, Integrity, Non-repudiation",,
What is POP?,"Post Office Protocol, version3 (POP3) and Internet Mail Access Protocol version4 (IMAP4) are protocol used by a mail server in conjunction with SMTP to receive and hold mail for hosts.",,
What is the function of SMTP?,The TCP/IP protocol supports electronic mail on the Internet is called Simple Mail Transfer (SMTP). It is a system for sending messages to other computer users based on email addresses. SMTP provides mail exchange between users on the same or different computers.,,
How does MIME enhance SMTP?,MIME is a supplementary protocol that allows non-ASCII data to be sent through SMTP. MIME transforms non-ASCII data at the sender site to NVT ASCII data and deliverers it to the client SMTP to be sent through the Internet.,,
Why is an application such as POP needed for electronic messaging?,"Workstations interact with the SMTP host, which receives the mail on behalf of every host in the organization, to retrieve messages by using a client-server protocol such as Post Office Protocol, version 3(POP3).",,
Write short notes on FTP?,"Transfer a file from one system to another, TCP connections, Basic model of FTP",,
What is HTTP?,"HTTP transactions,HTTP messages,URL",,
What is the WWW in detail?,"Hypertext & Hypermedia,Browser Architecture,Categories of Web Documents,HTML,CGI Java",,
What is Electronic mail?,"Email addressing,Message headers,Formatted email,Functions of email,User agent and message transfer agent,Simple mail Transfer protocol,Multipurpose internet mail extensions,Post Office Protocol (POP),IMAP",,
What is Domain Name System?,"Components of DNS is DNS in the internet Name space,Domain name Space Resolution,Message format Resource records,Name servers,Dynamic Domain Same system (DDNS)",,
What is a network ?,A network is the connection of two or more computers. These computers are linked together.,,
What are the responsibilities of Application Layer?,"The Application Layer enables the user, whether human or software, to access the network. It provides user interfaces and support for services such as e-mail, shared database management and other types of distributed information services",,
What are the three types of WWW documents ?,"static, dynamic and active.",,
Explain the static WWW documents ?,Fixed-content documents that are created and stored in a server.,,
Explain the dynamic WWW docunents ?,Created by web server whenever a browser requests the document.,,
Explain the active WWW documents ?,A program to be run at the client side.,,
What is fully Qualified Domain Name?,If a label is terminated by a null string is called a Fully Qualified Domain Name.,,
What is Generic Domains?,Generic domain defines registered hosts according to their generic behavior. Each node in the tree defines a domain .,,
What are the functions of SMTP?,System for sending messages to other computer users based on e-mail addresses.,,
How does the functions of SMTP work ?,"SMTP provides mail exchange between users on the same or different computers:User Agent,Mail Transfer Agent,Multipurpose Internet Mail Extensions,Post Office Protocol",,
What is physical media?,"Twisted pair cable,Coaxial cable,ISDN line",,
What is Twisted pair cable?,consists of two independently insulated wires twisted around each other,,
What is Coaxial cable ?,consists of an insulated center wire grounded by a shield of braided wire Fiber optic cable ?╟⌠ contains hundreds of clear fiberglass or plastic fibers,,
What is ISDN line?,ISDN line ?╟⌠ a special digital telephone line that transmits and receives information at very high speeds,,
What is wireless media ?,"Microwave system ,Satellite system ,Cellular technology",,
What is Microwave system ?,transmits data via high-frequency radio signals through the atmosphere,,
What is Satellite system ?,"receive signals from the earth, amplify them, and then transmit back these signals to the appropriate locations on the earth.",,
What is Cellular technology ?,uses antennae resembling telephone towers to pick up radio signals within a specific area,,
What is network typologies ?,Network Topology  is refers to the way computers and its peripheral environment  is configured to form networks.,,
What are the kinds of network topology ?,"Bus topology ,Star topology ,Ring topology ,Hybrid topology",,
Explain the Bus topology?,all computers are synchronize by a single line of cable.,,
Explain the Star topology?,"multiple computers are linked to a main computer, which is called a host",,
What is BGP Route Validation?,Route validation is an emerging approach in BGP security that verifies the legitimacy of BGP routing information before its propagation. Techniques such as Resource Public Key Infrastructure (RPKI) and BGP Origin Validation help prevent the propagation of forged or unauthorized BGP routes.,,
What is BGP Large Communities?,"BGP Large Communities is an extension to BGP communities that allows the encoding of larger values and provides more flexibility in expressing routing policies. Large Communities enable the tagging and manipulation of routes based on complex policies, making it easier to manage and control the flow of traffic in BGP networks.",,
What is BGP Monitoring Protocol (BMP)?,"BGP Monitoring Protocol is a protocol that allows the collection and monitoring of BGP routing information. BMP provides a standardized way to capture BGP updates, routing tables, and related information for analysis, troubleshooting, and security purposes.",,
What is BGP Add-Path?,"BGP Add-Path is an extension to BGP that allows the advertisement of multiple paths for a single destination prefix. With BGP Add-Path, routers can send and receive backup or alternative paths for a prefix, providing redundancy and flexibility in route selection.",,
What is the default administrative distance of OSPF (Open Shortest Path First)?,The default administrative distance of OSPF is 110.,,
